priority,unit_code,unit_label,unit_type,territorial_scope,queue_status,queue_reason,evidence_status,protocol_status,next_step,blocks_expansion,rule_version
8,archives-hub,Archives Hub,agregador_candidato,agregador nacional,monitoramento_protocolado_sem_incorporacao_mvp,"O protocolo documentou relevância, mas também ausência de rota estável; a unidade permanece fora do corpus ativo no MVP.",exige_js_cookies_ou_superficie_bloqueada,prototipo_leve_indica_bloqueio_em_sru_ou_oaipmh,identificacao_de_api_exportacao_sitemap_ou_rota_publica_estavel,False,2026-05-fechamento-europa-v1
8,cinematheque-suisse,Cinémathèque suisse,arquivo_individual_protocolado,Suíça / instituição individual europeia,monitoramento_protocolado_sem_incorporacao_mvp,"O protocolo documentou relevância e metadados públicos, mas não encontrou vídeo público incorporável; a unidade permanece fora do corpus ativo no MVP.","API Memobase retorna registros Film, mas mídia local/autorizada",protocolo_de_nao_incorporacao_por_acesso_restrito,monitorar_se_memobase_ou_site_institucional_passam_a_expor_video_publico,False,2026-05-fechamento-europa-v1
8,fiaf-filmmuseum-munchen,Filmmuseum München,arquivo_individual_protocolado,Munique / Alemanha / instituição individual europeia,monitoramento_protocolado_sem_incorporacao_mvp,"O protocolo confirmou acervo fílmico, mas as rotas públicas observadas são página institucional, história do acervo, programação, ingressos, vídeos institucionais gerais e busca instável na Sammlung Online; não há catálogo público de vídeos de acervo coletável.","site oficial confirma acervo fílmico, mas expõe programação e páginas institucionais",acervo_preservado_e_programacao_publica_sem_rota_de_video_de_acervo,retestar_site_oficial_sammlung_online_e_eventuais_catalogos_digitais_em_ciclos_futuros,False,2026-05-fechamento-europa-v1
8,fiaf-cineteca-italiana,Fondazione Cineteca Italiana,arquivo_individual_protocolado,Milão / Itália / instituição individual europeia,monitoramento_protocolado_sem_incorporacao_mvp,"O protocolo confirmou acervo fílmico, mas as rotas públicas observadas são programação de sala, streaming protegido por conta/compra/senha, visita presencial, plataforma educativa com registro e canal institucional recente; não há catálogo público de vídeos de acervo coletável.",site oficial confirma acervo fílmico; streaming aparece protegido; canal YouTube público não equivale a catálogo de acervo,acervo_preservado_programacao_publica_streaming_protegido_e_canal_publico_nao_catalografico,retestar_site_oficial_streaming_youtube_vimeo_e_eventual_catalogo_publico_de_acervo_em_ciclos_futuros,False,2026-05-fechamento-europa-v1
8,fiaf-cineteca-bologna,Fondazione Cineteca di Bologna,arquivo_individual_protocolado,Bolonha / Itália / instituição individual europeia,monitoramento_protocolado_sem_incorporacao_mvp,"A rota pública do Catalogo Film do Archivio audiovisivi foi validada, com resposta AJAX extensa, mas sem exportação pública integral, REST aberto ou coleta total viável no MVP; não se incorpora amostra parcial como corpus ativo.","site oficial confirma Archivio audiovisivi; Catalogo Film público responde por AJAX, mas sem exportação pública integral ou REST aberto",rota_publica_validada_ingestao_total_pendente,criar_ingestao_incremental_por_pagina_ou_solicitar_exportacao_publica_do_catalogo,False,2026-05-fechamento-europa-v1
8,francearchives,FranceArchives,agregador_candidato,agregador nacional,monitoramento_protocolado_sem_incorporacao_mvp,"O protocolo documentou relevância, mas também ausência de rota estável; a unidade permanece fora do corpus ativo no MVP.",exige_js_cookies_ou_superficie_bloqueada,prototipo_leve_materializado,identificacao_de_api_exportacao_sitemap_ou_rota_publica_estavel,False,2026-05-fechamento-europa-v1
